<?xml version="1.0"?>
<!DOCTYPE schema SYSTEM "schema-markup.dtd">

<schema name="physia-datadefs">

	<data table="REF_CPT">
		<import method="load" src="../refdata/cpt.txt"/>
	</data>

	<data table="REF_ICD">
		<import method="load" src="../refdata/icd.txt"/>
	</data>

	<data table="REF_Envoy_Payer">
		<import method="load" src="../refdata/envoy_payer.txt"/>
	</data>

	<data table="REF_USA_State">
		<delimrows>
			"AL","Alabama"
			"AR","Arkansas"
			"AZ","Arizona"
			"AK","Alaska"
			"CA","California"
			"CO","Colorado"
			"CT","Connecticut"
			"DE","Delaware"
			"DC","District Of Columbia"
			"FL","Florida"
			"GA","Georgia"
			"HI","Hawaii"
			"ID","Idaho"
			"IL","Illinois"
			"IN","Indiana"
			"IA","Iowa"
			"KS","Kansas"
			"KY","Kentucky"
			"LA","Louisiana"
			"ME","Maine"
			"MD","Maryland"
			"MA","Massachusetts"
			"MI","Michigan"
			"MN","Minnesota"
			"MS","Mississippi"
			"MO","Missouri"
			"MT","Montana"
			"NE","Nebraska"
			"NV","Nevada"
			"NH","New Hampshire"
			"NJ","New Jersey"
			"NM","New Mexico"
			"NY","New York"
			"NC","North Carolina"
			"ND","North Dakota"
			"OH","Ohio"
			"OK","Oklahoma"
			"OR","Oregon"
			"PA","Pennsylvania"
			"RI","Rhode Island"
			"SC","South Carolina"
			"SD","South Dakota"
			"TN","Tennessee"
			"TX","Texas"
			"UT","Utah"
			"VT","Vermont"
			"VA","Virginia"
			"WA","Washington"
			"WV","West Virginia"
			"WI","Wisconsin"
			"WY","Wyoming"
		</delimrows>
	</data>

</schema>

